{
  "schema_version": 1,
  "generated_at": "2026-08-10T06:16:50.347248735Z",
  "target_content_hash": "f6086b3322c82fb21d5da0c6cbd04f093ec20d7ca1e6094a9c2324cbeff6dd1d",
  "qualifying_uses_on_current_hash": 1,
  "open_incident_ids": [
    "evt_74c863ac-a621-4e58-9244-b7f1d562bfb6"
  ],
  "candidate_clusters": [
    {
      "symptom_key": "execution",
      "open_event_ids": [
        "evt_74c863ac-a621-4e58-9244-b7f1d562bfb6"
      ],
      "independent_incidents": 1,
      "max_severity": "friction"
    }
  ],
  "state": "collecting",
  "authorized_workflow": null,
  "authorization_reason": null,
  "trigger_event_ids": [],
  "threshold_session_id": null,
  "not_before": null,
  "active_review_id": null,
  "last_completed_review_id": null,
  "review_reentry_basis": null,
  "target_name": "to-issues",
  "target_repo_relative_path": ".claude/skills/to-issues",
  "derivation_session_id": "4e3fdbb2-079f-40e9-8836-be34988e87eb"
}
