{
  "schema_version": 1,
  "generated_at": "2026-08-13T04:41:01.435772884Z",
  "target_content_hash": "30711836e567cf009a340626d4085d5c7dd6b64d40dfeb09e048eb6e9833b831",
  "qualifying_uses_on_current_hash": 3,
  "open_incident_ids": [],
  "candidate_clusters": [],
  "state": "closed",
  "authorized_workflow": null,
  "authorization_reason": null,
  "trigger_event_ids": [],
  "threshold_session_id": null,
  "not_before": null,
  "active_review_id": null,
  "last_completed_review_id": null,
  "review_reentry_basis": null,
  "target_name": "reuse-evidence-capture",
  "target_repo_relative_path": ".claude/skills/reuse-evidence-capture",
  "derivation_session_id": "6b41f4fe-3fee-4f87-acec-f1218153441a"
}
