{
  "schema_version": 1,
  "generated_at": "2026-08-12T19:47:23.117032375Z",
  "target_content_hash": "4f78c44b72cc10105a92207f907cdf2efe3facd6def7646db34ca4bf4363671b",
  "qualifying_uses_on_current_hash": 4,
  "open_incident_ids": [
    "evt_8f6fab64-b7be-4036-af70-f499769d9121",
    "evt_943f3022-bc21-4764-96e9-ef0372064d73",
    "evt_a0f3585c-91ec-4b84-a6a3-a4a338e43f67",
    "evt_e9aea7f2-6f0d-4869-b2f5-93719f0ab0ae",
    "evt_15855638-e969-4b90-a44d-68ee2d639dd2"
  ],
  "candidate_clusters": [
    {
      "symptom_key": "output",
      "open_event_ids": [
        "evt_8f6fab64-b7be-4036-af70-f499769d9121",
        "evt_943f3022-bc21-4764-96e9-ef0372064d73",
        "evt_a0f3585c-91ec-4b84-a6a3-a4a338e43f67",
        "evt_e9aea7f2-6f0d-4869-b2f5-93719f0ab0ae",
        "evt_15855638-e969-4b90-a44d-68ee2d639dd2"
      ],
      "independent_incidents": 4,
      "max_severity": "material_failure"
    }
  ],
  "state": "eligible",
  "authorized_workflow": "skill-evolution",
  "authorization_reason": "friction_recurrence:output",
  "trigger_event_ids": [
    "evt_8f6fab64-b7be-4036-af70-f499769d9121",
    "evt_943f3022-bc21-4764-96e9-ef0372064d73",
    "evt_a0f3585c-91ec-4b84-a6a3-a4a338e43f67"
  ],
  "threshold_session_id": "6f1fc02b-4ed5-4f18-9b11-a74ee074b1af",
  "not_before": null,
  "active_review_id": null,
  "last_completed_review_id": null,
  "review_reentry_basis": "first_eligibility",
  "target_name": "to-prd",
  "target_repo_relative_path": ".claude/skills/to-prd",
  "derivation_session_id": "8c7dea51-658e-4edf-a25f-13140b5d4961"
}
