{
  "schema_version": 1,
  "generated_at": "2026-08-10T14:34:46.883816412Z",
  "target_content_hash": "5ae942c389ca86d6f232cc5ca5251ffb74a670900351671353e8c4387f98dd3a",
  "qualifying_uses_on_current_hash": 2,
  "open_incident_ids": [],
  "candidate_clusters": [],
  "state": "closed",
  "authorized_workflow": null,
  "authorization_reason": null,
  "trigger_event_ids": [],
  "threshold_session_id": null,
  "not_before": null,
  "active_review_id": null,
  "last_completed_review_id": null,
  "review_reentry_basis": null,
  "target_name": "codebase-design",
  "target_repo_relative_path": ".claude/skills/codebase-design",
  "derivation_session_id": "462e17f5-61ed-4b10-a376-56d8bdf4a244"
}
