{
  "schema_version": 1,
  "generated_at": "2026-08-11T06:01:54.457577429Z",
  "target_content_hash": "74bcaf2b6159d57a0a93f6683837b601afab3dae1e9094ab4b77c15b3f535a63",
  "qualifying_uses_on_current_hash": 3,
  "open_incident_ids": [
    "evt_0704aa15-b98c-4022-9fce-f8fae01bb40e"
  ],
  "candidate_clusters": [
    {
      "symptom_key": "execution",
      "open_event_ids": [
        "evt_0704aa15-b98c-4022-9fce-f8fae01bb40e"
      ],
      "independent_incidents": 1,
      "max_severity": "friction"
    }
  ],
  "state": "collecting",
  "authorized_workflow": null,
  "authorization_reason": null,
  "trigger_event_ids": [],
  "threshold_session_id": null,
  "not_before": null,
  "active_review_id": null,
  "last_completed_review_id": null,
  "review_reentry_basis": null,
  "target_name": "improve-codebase-architecture",
  "target_repo_relative_path": ".claude/skills/improve-codebase-architecture",
  "derivation_session_id": "144a74b6-8900-49f2-acdb-c08f95f4d65f"
}
