{
  "schema_version": 1,
  "generated_at": "2026-08-12T16:30:51.753022473Z",
  "target_content_hash": "58ee690ec479d13e9ff51567f4e57087f319ac7a1aca6511d61c8628f5e43fa6",
  "qualifying_uses_on_current_hash": 19,
  "open_incident_ids": [
    "evt_32e7534e-2a65-478e-8c2e-c4a37dc46596",
    "evt_f39866ac-2585-4708-bc3b-096e3c721ef3",
    "evt_35d21a7d-416a-48a1-b85e-4e2593327873",
    "evt_f3818540-7d53-42db-8f09-0e4b2498da95"
  ],
  "candidate_clusters": [
    {
      "symptom_key": "output",
      "open_event_ids": [
        "evt_32e7534e-2a65-478e-8c2e-c4a37dc46596",
        "evt_35d21a7d-416a-48a1-b85e-4e2593327873"
      ],
      "independent_incidents": 2,
      "max_severity": "material_failure"
    },
    {
      "symptom_key": "execution",
      "open_event_ids": [
        "evt_f39866ac-2585-4708-bc3b-096e3c721ef3",
        "evt_f3818540-7d53-42db-8f09-0e4b2498da95"
      ],
      "independent_incidents": 2,
      "max_severity": "friction"
    }
  ],
  "state": "eligible",
  "authorized_workflow": "skill-evolution",
  "authorization_reason": "ten_use_unresolved",
  "trigger_event_ids": [
    "evt_32e7534e-2a65-478e-8c2e-c4a37dc46596"
  ],
  "threshold_session_id": "019febe5-2a89-76b3-ad6d-3f5d8f0e4bba",
  "not_before": null,
  "active_review_id": null,
  "last_completed_review_id": null,
  "review_reentry_basis": "first_eligibility",
  "target_name": "code-review",
  "target_repo_relative_path": ".claude/skills/code-review",
  "derivation_session_id": "019ff6b4-32db-7ee2-bc7d-e5fe82db03dc"
}
